figure,"The children were asked to ____ out the area of the rectangle."
figure,"It was difficult to ____ out what the artist was trying to convey with their painting."
figure,"The coach told the team to ____ out their positions before the game."
filthy,"The streets were ____ after the storm."
filthy,"After a long day at the construction site, his clothes were ____."
filthy,"The old attic was filled with ____ cobwebs."
filthy,"The dog had been rolling in the mud and was absolutely ____."
finance,"The company's ____ department is responsible for managing its assets and liabilities."
finance,"He studied ____ at university and now works as an investment banker."
finance,"The government has announced a new package of ____ measures to help small businesses."
finance,"She's pursuing a career in ____, hoping to become a financial analyst."
fine,"The weather was ____ today, perfect for a walk in the park."
fine,"I am ____, thank you for asking."
fine,"The doctor said my results were ____, which was a huge relief."
fine,"She looked ____ in her new dress."
firework,"The sky lit up with a dazzling display of _____."
firework,"The children were mesmerized by the exploding _____."
firework,"The Fourth of July wouldn't be the same without _____."
firework,"The _____, a symbol of celebration, burst into a kaleidoscope of colors."
fit,"The new shoes didn't ____ me properly, so I returned them."
fit,"He was so ____ for the job, he got it on the spot."
fit,"I'm trying to ____ into my old jeans, but I'm struggling."
fit,"The puzzle pieces ____ together perfectly."
flatmate,"My ____  borrowed my favourite sweater without asking!"
flatmate,"I'm going to have a movie night with my ____ tonight."
flatmate,"I think my ____ might be secretly a cat person!"
flatmate,"I'm having a housewarming party for my new ____."
flattery,"She could tell he was only being nice to her out of ____."
flattery,"His ego was so inflated that he lapped up any kind of ____."
flattery,"The politician's speech was full of ____ and empty promises."
flattery,"Despite the ____, she knew he wasn't truly interested in her work."
flee,"The frightened rabbit ___ from the approaching fox."
flee,"The refugees ___ their war-torn country in search of safety."
flee,"After the earthquake, the villagers ___ their homes for higher ground."
flee,"The criminals ___ the scene of the crime after the robbery."
fleece,"The sheep were shorn of their thick ____."
fleece,"The warm ____ blanket kept me cozy all night."
fleece,"The salesman tried to ____ the unsuspecting customer."
fleece,"The mountain climber used a rope made of synthetic ____."
flight,"The bird took ____ over the tall trees."
flight,"We booked a ____ to Hawaii for our vacation."
flight,"The pilot announced that the ____ would be delayed due to bad weather."
flight,"The astronaut's ____ to the International Space Station was a success."
flow,"The river ______ steadily towards the sea."
flow,"Her tears ______ freely as she listened to the sad story."
flow,"The traffic ______ was heavy during rush hour."
flow,"The ______ of information was constant and overwhelming."
fluctuate,"The price of gasoline tends to ____ throughout the year."
fluctuate,"The stock market can ____ wildly in response to news events."
fluctuate,"The quality of the internet connection can ____ depending on the time of day."
fluctuate,"My mood tends to ____ throughout the day."
fluctuate,"The stock market prices tend to ____ throughout the day."
fluctuate,"The temperature in the desert can ____ wildly between day and night."
fluctuate,"The number of tourists visiting the city ____ depending on the season."
fluctuate,"My mood can ____ based on the weather."
"focus on","We need to ______ the most important tasks first."
"focus on","The team decided to ______ improving customer service."
"focus on","It's important to ______ your strengths."
"focus on","Let's ______ finding a solution to this problem."
fold,"The chef carefully ______ the dough before placing it in the oven."
fold,"She ______ her arms and stared out the window."
fold,"The company decided to ______ due to financial losses."
fold,"The detective meticulously ______ the evidence, placing it in a sealed bag."
force,"A _____ can cause an object to start moving, stop moving, or change direction."
force,"The amount of _____ needed to move an object depends on its mass and acceleration."
force,"Friction is a _____ that opposes motion."
force,"Gravity is a _____ of attraction between objects with mass."
forceful,"The speaker delivered a _____, passionate speech that captivated the audience."
forceful,"The general's _____ leadership inspired his troops to victory."
forceful,"The _____ wind battered the trees, sending leaves scattering across the ground."
forceful,"The judge issued a _____ ruling that left no room for interpretation."
forecast,"The weather _______ for tomorrow is sunny and warm."
forecast,"The company's sales _______ for the next quarter are looking promising."
forecast,"The financial analysts are working on a _______ of the stock market's performance."
forecast,"The meteorologist issued a severe weather _______ for the region."
forge,"The blacksmith used a hammer to ______ a new horseshoe."
forge,"The team was determined to ______ a path to victory."
forge,"The artist spent years ______ her unique style."
forge,"Despite the challenges, they ______ a strong bond of friendship."
forgery,"The art dealer was arrested for ____ after selling a painting that was later discovered to be a fake."
forgery,"The bank teller was fired for ____ after attempting to cash a fraudulent check."
forgery,"The detective uncovered a complex ____ operation involving stolen identities and fake passports."
forgery,"The judge ruled that the signature on the will was a ____ and declared the document invalid."
forgery,"The detective suspected a _____, as the signature on the document didn't match the known handwriting of the suspect."
forgery,"The art collector was devastated to discover that his prized painting was a _____, not an original."
forgery,"The authorities arrested the suspect for _____, as he had created fake IDs for illegal activities."
forgery,"The museum curator carefully examined the painting for signs of _____, but declared it to be authentic."
former,"The ___ president of the company was fired for misconduct."
former,"After years of working at the firm, she became a ___ employee."
former,"The ___ champion of the tournament is now retired."
former,"He visited his ___ home town and reminisced about his childhood."
formerly,"The building, ____ known as a department store, is now a museum."
formerly,"He was ____ a lawyer, but he now works as a writer."
formerly,"The city, ____ a small fishing village, has grown into a bustling metropolis."
formerly,"She ____ worked as a waitress, but now owns her own bakery."
formulate,"The scientists spent months trying to ______ a new theory."
formulate,"The chef ______ a unique recipe for the competition."
formulate,"The politician needed to ______ a convincing argument."
formulate,"The students had to ______ their own research questions."
forthcoming,"The company announced the ______ release of its new product line."
forthcoming,"The speaker gave a detailed overview of the ______ events."
forthcoming,"We are eagerly awaiting the ______ results of the research study."
forthcoming,"The author is working on a ______ novel about the life of a famous scientist."
fortify,"The soldiers worked tirelessly to ____ the city walls against the approaching enemy."
fortify,"She tried to ____ her resolve to stay on her diet."
fortify,"He ____ his argument with several compelling facts."
fortify,"The doctor recommended a vitamin supplement to ____ her immune system."
fracture,"The doctor confirmed that the patient had suffered a ____ in their leg."
fracture,"The earthquake caused a ____ in the ancient temple wall."
fracture,"The ____ in the bone was so severe that it required surgery."
fracture,"The delicate porcelain vase was left in pieces after the ____."
frail,"The old woman's bones were so ____ that she needed a walker to get around."
frail,"The ____ bridge swayed precariously in the wind."
frail,"After a long illness, the patient was left feeling ____ and weak."
frail,"The ____ economy could easily be thrown into a recession by a global crisis."
frame,"The artist carefully ______ the painting with a beautiful, ornate border."
frame,"The detective used the clues to ______ a theory about the crime."
frame,"The building's steel ______ was strong enough to withstand the earthquake."
frame,"The photographer's camera lens had a wide ______, allowing them to capture a panoramic view."
freed,"The prisoner was finally ____ from his cell after years of wrongful imprisonment."
freed,"The bird was ____ from its cage and soared into the sky."
freed,"The wind ____ the kite from its string, sending it dancing across the sky."
freed,"After a long day of work, she ____ her mind by reading a good book."
fulfil,"The team worked tirelessly to ______ their goal of raising $10,000 for charity."
fulfil,"It was a dream that took years to ______, but it was worth every moment."
fulfil,"The artist strives to ______ their creative vision through their work."
fulfil,"The new CEO promised to ______ the company's commitment to sustainability."
fundamental,"The right to free speech is a ____ principle of democracy."
fundamental,"The ability to read and write is a ____ skill for success in modern society."
fundamental,"The teacher emphasized the ____ concepts of algebra."
fundamental,"Understanding the ____ principles of physics is crucial for any aspiring engineer."
funeral,"The somber music played at the ____, filling the air with a sense of loss."
funeral,"The mourners gathered at the ____ to pay their last respects."
funeral,"After the ____, family and friends gathered for a reception."
funeral,"The priest delivered a moving eulogy at the ____."
fussy,"My grandmother is a very ____ eater, and she only likes a few specific foods."
fussy,"The baby was so ____ that it wouldn't stop crying until it got its bottle."
fussy,"She's very ____ about her clothes, and she always looks perfectly put-together."
fussy,"The dog was ____ about its treats, and it would only eat the ones with cheese."
fuzzy,"The old sweater felt ____ and warm."
fuzzy,"I woke up with a ____ memory of the dream."
fuzzy,"The picture was too ____ to make out any details."
fuzzy,"The cat's fur was so ____ that it looked like a cloud."
gather,"The students ____ in the library to study for the test."
gather,"Let's ____ around the campfire and tell stories."
gather,"The detective worked hard to ____ evidence to solve the mystery."
gather,"We will ____ all the ingredients for the cake."
gender,"The new policy aims to ensure equal opportunities for all individuals, regardless of ____."
gender,"Our society is becoming more accepting of diverse ____ identities."
gender,"____ stereotypes can have a negative impact on individuals' self-esteem."
gender,"The study examined the relationship between ____ and career choices."
generate,"The new software can ____ reports based on user input."
generate,"The wind turbine is designed to ____ electricity from the wind."
generate,"The company plans to ____ new ideas for its next product line."
generate,"The artist used a computer program to ____ realistic images."
"genre (","The movie was a classic example of the ____ genre, filled with action, explosions, and witty dialogue."
"genre (","She's a huge fan of the ____ genre, spending hours reading fantasy novels and watching epic movies."
"genre (","The author's latest book defied categorization, blending elements from several different ____s."
"genre (","My favorite ____ is historical fiction, as I love learning about different time periods and cultures."
"get rid of","The old, broken chair was taking up too much space, so I finally decided to ____ ____ ____ it."
"get rid of","It's time to ____ ____ ____ those old clothes that you never wear anymore."
"get rid of","The company needed to ____ ____ ____ some of its outdated products."
"get rid of","I was feeling overwhelmed by all the clutter, so I decided to ____ ____ ____ some unnecessary items."
giant,"The redwoods are some of the most impressive ____ trees in the world."
giant,"The ____ squid is a fascinating and mysterious creature of the deep sea."
giant,"The movie featured a ____ robot that wreaked havoc on the city."
giant,"The children were amazed by the ____ dinosaur skeleton at the museum."
"give up","I know it's hard, but don't ____ ____ on your dreams."
"give up","After hours of searching, she was about to ____ ____, but then she found it."
"give up","The team was losing badly, but their coach encouraged them not to ____ ____."
"give up","Even though the problem seemed impossible, he refused to ____ ____."
glance,"I took a quick ____ at the clock and realized I was late."
glance,"The detective cast a ____ around the room, searching for clues."
glance,"She gave him a ____ of understanding, but said nothing."
glance,"The child ____ up at his mother, eyes wide with wonder."
gloom,"The sudden storm cast a ____ over the picnic."
gloom,"The news of her illness filled the room with ____."
gloom,"Despite the ____, the child's laughter brought a spark of joy."
gloom,"A ____ settled over the town after the factory closed."
glorify,"The artist's goal was to ______ the beauty of the natural world."
glorify,"The athlete's performance ______ the sport."
glorify,"The children's laughter ______ the holiday season."
glorify,"The ancient ruins ______ the city's rich history."
goal,"My biggest ______ in life is to ______."
goal,"Setting realistic ______ is important for ______."
goal,"The team worked hard to achieve their ______ of ______."
goal,"What is your ______ for the ______?"
govern,"The elected officials will ______ the city for the next four years."
govern,"The rules of the game ______ how players can interact with each other."
govern,"The United States is a democracy, where the people ______ the country."
govern,"The laws ______ how citizens are expected to behave."
government,"The _____ is responsible for providing essential services like education and healthcare."
government,"The _____ plays a crucial role in regulating the economy."
government,"Citizens participate in the _____ through voting and political activism."
government,"The _____ has the authority to enforce laws and maintain order."
grab,"I need to ______ a quick bite to eat before the meeting."
grab,"Could you please ______ me a glass of water from the kitchen?"
grab,"She ______ her bag and rushed out the door."
grab,"He ______ the opportunity to travel abroad."
gradually,"The sun ______ set below the horizon, painting the sky in hues of orange and purple."
gradually,"Over time, the once vibrant colors of the painting ______ faded."
gradually,"As the years passed, the old man's health ______ declined."
gradually,"With each passing day, the snow ______ melted away, revealing the green grass beneath."
grant,"The university received a large ____ to fund its new research project."
grant,"The king decided to ____ the young knight a noble title."
grant,"After years of hard work, she was finally ____ed a promotion."
grant,"The council voted to ____ permission for the construction project."
grasp,"The child struggled to ___ the concept of fractions."
grasp,"After years of study, she finally began to ___ the complexities of quantum physics."
grasp,"The artist's work allowed viewers to ___ the beauty of nature in a new way."
grasp,"He was unable to ___ the significance of the meeting."
graveyard,"The old ____ was overgrown with weeds and vines."
graveyard,"The town's history was etched in the tombstones of the ____."
graveyard,"The ____ sat silent and still under the moonlight."
graveyard,"He felt a shiver run down his spine as he walked through the ____."
groom,"The wedding party helped the ____ with his bow tie."
groom,"The horse was being ____ for the upcoming race."
groom,"She hired a professional to ____ her dog for the competition."
groom,"The groom-to-be was ____ for his upcoming wedding."
"grow tired of","After years of working the same job, she began to ____ ____ ____ the routine."
"grow tired of","The children quickly ____ ____ ____ the repetitive game."
"grow tired of","He ____ ____ ____ the constant noise from his neighbors."
"grow tired of","As the journey continued, the hikers ____ ____ ____ the long, dusty road."
growl,"The lion let out a deep ____ at the approaching zebra."
growl,"The dog ____ at the stranger, warning him to stay away."
growl,"The engine ____ to life as the driver turned the key."
growl,"The old man ____ in frustration as he struggled to open the jar."
guide,"The tour ______ led us through the ancient ruins."
guide,"The GPS system served as a reliable ______ on our road trip."
guide,"The teacher provided a helpful ______ for the upcoming test."
guide,"The hiker followed the ______ along the mountain trail."
harass,"It is illegal to ____ someone based on their race, religion, or sexual orientation."
harass,"The company has a zero-tolerance policy for ____ of any kind."
harass,"She reported the ____ to the police, providing them with evidence of the abuse."
harass,"He felt ____ by the constant negative comments and unwanted attention."
harbour,"The old lighthouse stood at the edge of the _____, guiding ships safely into the port."
harbour,"The small town was known for its picturesque _____, lined with colorful boats."
harbour,"The storm raged outside, but inside the _____, the sailors felt safe and secure."
harbour,"The refugees found temporary shelter in the _____ until they could be resettled."
hardship,"Overcoming ______ can build resilience and character."
hardship,"Despite facing ______, she never gave up on her dreams."
hardship,"The community came together to support those experiencing ______."
hardship,"He learned valuable lessons about life through the ______ he endured."
harshly,"The teacher ____ criticized the student's lack of effort."
harshly,"The sun beat down ____ on the parched land."
harshly,"The judge ruled ____ against the defendant."
harshly,"The wind whipped ____ against the windows, rattling the panes."
hasten,"The doctor advised me to ____ the healing process by taking these supplements."
hasten,"The news of the storm ____ our plans to go camping."
hasten,"The rising tide ____ the need for immediate evacuation."
hasten,"The recent discoveries in genetics ____ the development of new therapies."
havoc,"The storm wreaked ______ on the coastal town, destroying homes and businesses."
havoc,"The unexpected news caused ______ in the stock market, sending prices plummeting."
havoc,"The mischievous children were known for creating ______ wherever they went."
havoc,"The fire in the library caused ______, destroying countless valuable books."
hazard,"A slippery floor can be a serious ______."
hazard,"The construction site was filled with ______."
hazard,"It is important to identify and eliminate potential ______ in the workplace."
hazard,"The lack of safety equipment created a significant ______."
hazardous,"The chemicals in the lab were considered ______ and required special handling."
hazardous,"The construction site was deemed ______ due to the presence of asbestos."
hazardous,"The volcano's eruption released ______ gases into the atmosphere."
hazardous,"The old mine was closed because it was deemed ______ to workers."
hectic,"The city was a ______ place, with people rushing everywhere."
hectic,"After a ______ week at work, she was looking forward to a relaxing weekend."
hectic,"The market was ______ with shoppers trying to find the best deals."
hectic,"He had a ______ schedule, juggling multiple projects and deadlines."
hesitate,"Don't ______ to ask for help if you need it."
hesitate,"He ______ for a moment before answering the question."
hesitate,"She ______ at the edge of the cliff, afraid to look down."
hesitate,"They ______ to make a decision, unsure of the consequences."
highly,"The new restaurant was ____ praised by the food critics."
highly,"The scientist's research was ____ regarded in the field."
highly,"The team's performance was ____ impressive."
highly,"The professor's lectures were ____ engaging."
hinder,"The heavy rain and strong winds could ______ the search and rescue efforts."
hinder,"Lack of funding could ______ the development of new medical treatments."
hinder,"Her fear of public speaking ______ her ability to give a successful presentation."
hinder,"His broken leg will ______ his progress in the marathon."
hire,"The company decided to ____ a new marketing manager."
hire,"They ____ a team of engineers to work on the project."
hire,"She was ____ to write the company's annual report."
hire,"We need to ____ a contractor to fix the roof."
hitchhiker,"The weary traveler offered the ___ a ride to the next town."
hitchhiker,"The ___ waved their thumb frantically at passing cars."
hitchhiker,"A lone figure stood on the roadside, looking like a classic ___."
hitchhiker,"The police were suspicious of the ___'s story about their travels."
hollow,"The old tree trunk was completely _____, making it easy for the squirrels to climb inside."
hollow,"The actor's victory speech was _____, lacking any real emotion or conviction."
hollow,"After the storm, the once-mighty oak stood as a _____, skeletal reminder of the destructive power of nature."
hollow,"The artist created a sculpture of a _____, bird, emphasizing the fragility of life."
hopefully,"I finished my homework, ____ I can relax now."
hopefully,"We left early, ____ we'll beat the traffic."
hopefully,"He studied hard, ____ he'll pass the test."
hopefully,"The weather looks good, ____ we can go to the beach."
horrible,"The food was so ______ that I couldn't even finish it."
horrible,"The movie was ______ and left me feeling depressed."
horrible,"The weather was ______ and forced us to cancel our plans."
horrible,"The smell was ______ and made me want to gag."
huge,"The elephant was a ____ creature."
huge,"The skyscraper was ____ and dominated the skyline."
huge,"There was a ____ crowd at the concert."
huge,"The meteor left a ____ crater."
humiliate,"The pranksters tried to ____ their teacher by hiding his car keys."
humiliate,"The athlete's poor performance in the championship game served to ____ him in front of his fans."
humiliate,"The politician's public apology seemed to ____ him further."
humiliate,"The manager's harsh words were meant to ____ the employee into working harder."
hunter,"The skilled ____ stalked his prey through the dense forest."
hunter,"The ____ used his keen senses to track his quarry."
hunter,"The ____ carefully laid a trap for his target."
hunter,"The ____ returned home with a successful hunt."
"hurricane (hörikeyn)","The _____, a powerful storm with strong winds and heavy rains, made landfall on the coast."
"hurricane (hörikeyn)","The residents were warned to evacuate their homes before the _____, a natural disaster with devastating consequences."
"hurricane (hörikeyn)","The _____, a massive rotating storm, caused widespread flooding and damage."
"hurricane (hörikeyn)","After the _____, a period of rebuilding and recovery was needed to restore the affected areas."
iceberg,"The Titanic collided with a massive _____."
iceberg,"Only a small portion of an _____ is visible above the water."
iceberg,"The _____ drifted slowly towards the shore."
iceberg,"The polar bear walked across the frozen sea, avoiding the jagged edges of the _____."
identify,"The scientist was able to ____ the unknown substance using a mass spectrometer."
identify,"It's important to ____ your target audience before launching a marketing campaign."
identify,"The detective used clues to ____ the suspect in the crime."
identify,"The doctor asked the patient to ____ any allergies they might have."
idle,"The engine was left to ______ for a few minutes before being turned off."
idle,"She couldn't stand to be ______, so she started working on a new project."
idle,"It's hard to stay ______ when there's so much to do."
idle,"They spent the afternoon ______ by the lake, watching the boats go by."
ignore,"It's important to learn to _______ negativity and focus on the positive."
ignore,"The teacher told the students to _______ the distractions and focus on their work."
ignore,"Despite the noise and chaos, the dog remained calm and chose to _______ it."
ignore,"When faced with a difficult decision, it's best to _______ your emotions and think clearly."
illusion,"The magician's trick was a clever _____, making it seem like the rabbit vanished into thin air."
illusion,"The desert mirage was a shimmering _____, making travelers believe there was water nearby."
illusion,"The artist's work was a masterful _____, blending reality and fantasy in a way that captivated viewers."
illusion,"The politician's promises were a dangerous _____, designed to mislead voters."
illustrate,"The artist used vibrant colors to ____ the beauty of the sunset."
illustrate,"The teacher used a diagram to ____ the process of photosynthesis."
illustrate,"The author used vivid imagery to ____ the horrors of war."
illustrate,"The examples in the textbook ____ the concepts being taught."
imagine,"Imagine ______ where everyone can speak every language."
imagine,"Imagine ______ on a deserted island."
imagine,"Imagine ______ without technology."
imagine,"Imagine ______ in 100 years."
imitate,"The young bird tried to ____ its mother's song."
imitate,"The artist was known for his ability to ____ famous paintings."
imitate,"Children often ____ the behavior of their parents."
imitate,"The comedian's act was a hilarious ____ of a popular politician."
immediate,"The doctor ordered an ____ medical evaluation."
immediate,"The situation required an ____ response."
immediate,"The team's goal was to achieve ____ results."
immediate,"His reaction to the news was one of ____ concern."
