overlap,"The two circles ____ in the center, creating a shaded area."
overlap,"Her responsibilities at work ____ with her personal life, making it hard to find a balance."
overlap,"The timeframes for the two projects ____, meaning we'll need to adjust our schedule."
overlap,"The research findings ____ with previous studies, reinforcing the conclusions."
overlook,"The detective was careful not to ______ any detail in the crime scene."
overlook,"The mountaintop offered a breathtaking view, allowing us to ______ the entire city."
overlook,"It's easy to ______ the small things in life, but they often hold the greatest meaning."
overlook,"The manager's decision to ______ the employee's mistake was a sign of her forgiveness."
overtake,"The fast car quickly ______ the slower one on the highway."
overtake,"The determined runner ______ the leader in the final lap."
overtake,"The new technology is expected to ______ the older version in popularity."
overtake,"The company's sales figures have ______ their previous record."
overtake,"The faster train will ____ the slower train in a few minutes."
overtake,"The determined athlete was able to ____ the competition in the final lap."
overtake,"The company's new product is expected to ____ the market share of its rivals."
overtake,"The rebels were able to ____ the government forces in the night raid."
partially,"The curtains were ____ drawn, letting in a sliver of sunlight."
partially,"The cake was ____ baked, but the inside was still gooey."
partially,"The car was ____ submerged in the floodwaters."
partially,"The project was ____ completed, but there's still some work to be done."
"participate in","The students will ____ the science fair by showcasing their projects."
"participate in","I hope you'll ____ the discussion and share your thoughts."
"participate in","To be a part of the team, you must ____ the training sessions."
"participate in","It's important to ____ community events to foster a sense of belonging."
participation,"The students' active _______ in the project led to excellent results."
participation,"The community's _______ in the fundraising drive was overwhelming."
participation,"High _______ in the election is crucial for a democratic society."
participation,"Her _______ in the marathon was a testament to her determination."
"particular (pıtik","The detective was looking for a ______ piece of evidence."
"particular (pıtik","She had a ______ fondness for chocolate."
"particular (pıtik","He was known for his ______ attention to detail."
"particular (pıtik","This type of flower requires ______ care."
particularly,"The restaurant was __particularly__ busy on Friday nights."
particularly,"He was __particularly__ interested in the history of the building."
particularly,"The weather was __particularly__ bad this week."
particularly,"She was __particularly__ skilled at playing the piano."
passenger,"The train was packed, and the ____ had to stand."
passenger,"The ____ was late for their flight."
passenger,"The ____ was injured in the car accident."
passenger,"The bus driver asked the ____ to move to the back."
passionately,"He argued ____ about the importance of environmental protection."
passionately,"The musician played the piano ____, pouring his heart and soul into every note."
passionately,"She spoke ____ about her dream of becoming a doctor."
passionately,"The children danced ____ to the music, their faces lit up with joy."
patiently,"The child waited ____ for their birthday present."
patiently,"The mechanic worked ____ on the car, trying to diagnose the problem."
patiently,"She listened ____ to his explanation, even though she didn't agree with it."
patiently,"The artist worked ____ on their masterpiece, adding small details with precision."
pavement,"The children skipped along the _____, laughing and singing."
pavement,"The old man walked slowly down the _____, leaning on his cane."
pavement,"The cracks in the _____ were filled with weeds."
pavement,"The bus stopped abruptly, causing a jolt that sent me sprawling onto the ____."
"peace and quiet","After a long day at work, all I wanted was some _____."
"peace and quiet","The library was the perfect place to find _____."
"peace and quiet","The countryside offered a welcome escape from the city's constant noise and bustle, providing _____."
"peace and quiet","He retreated to his study in search of _____. "
peak,"The mountain climber reached the ____ of the mountain after a long and arduous climb."
peak,"Sales reached their ____ during the holiday season."
peak,"The ____ of the performance came when the lead singer hit the high note."
peak,"The artist's career reached its ____ in the early 2000s."
peculiar,"The old house had a  ___  smell that lingered in the air."
peculiar,"Her behavior was  ___  and drew stares from everyone in the room."
peculiar,"The painting was  ___  in its composition, with colors clashing in an unexpected way."
peculiar,"He had a  ___  talent for remembering faces, even after years had passed."
pedestrian,"The ______ was startled by the loud car horn."
pedestrian,"The city council is planning to install more crosswalks to improve ______ safety."
pedestrian,"It's important to be aware of your surroundings when walking, especially as a ______ in a busy city."
pedestrian,"The ______ mall was bustling with shoppers and street performers."
penalize,"The referee will ______ the team for a foul."
penalize,"The teacher will ______ students for late assignments."
penalize,"The government will ______ companies that pollute the environment."
penalize,"The judge may ______ the defendant for perjury."
perceive,"We often ____ the world through the lens of our own experiences."
perceive,"The artist wanted viewers to ____ the painting in a new way."
perceive,"It is important to ____ the needs of others."
perceive,"He was unable to ____ the subtle changes in her mood."
permission,"I asked my parents for ____ to stay out late."
permission,"The teacher gave us ____ to leave early."
permission,"You need ____ from the manager to use the company car."
permission,"They were denied ____ to enter the restricted area."
persevering,"The athlete's ____ spirit helped her overcome the obstacles and win the championship."
persevering,"Despite the challenges, the team remained ____ and eventually achieved their goal."
persevering,"Through years of ____ effort, the scientist finally made a breakthrough in her research."
persevering,"The artist's ____ nature allowed her to complete her masterpiece even after facing countless setbacks."
persist,"Despite the challenges, she decided to ______ with her goals."
persist,"Even when faced with doubt, he chose to ______ in his efforts."
persist,"It's important to ______ in learning new things throughout life."
persist,"The rumors ______ despite the lack of evidence."
persuade,"The lawyer tried to ______ the jury of the defendant's innocence."
persuade,"The salesman was very good at ______ people to buy his products."
persuade,"The teacher ______ her students to study hard for the test."
persuade,"The politician tried to ______ the voters to support her policies."
pessimism,"The team's recent losses have fueled a sense of ____ among the fans."
pessimism,"Despite the challenges, she remained optimistic, refusing to succumb to ____."
pessimism,"His constant ____ about the future made it difficult to enjoy the present."
pessimism,"The doctor's ____ about the patient's recovery was a blow to their family."
pet,"I have a ____ cat named Mittens."
pet,"My favorite ____ is a dog."
pet,"He takes his ____ for a walk every day."
pet,"She loves to ____ her cat."
pioneer,"The Wright brothers were ______ of aviation."
pioneer,"Marie Curie was a ______ in the field of radioactivity."
pioneer,"Neil Armstrong was a ______ in space exploration."
pioneer,"The ______ of the Wild West faced many dangers."
placement,"The job candidate's impressive portfolio secured him a coveted ____ in the marketing department."
placement,"The interior designer carefully considered the ____ of the furniture to create a balanced and inviting space."
placement,"The team's ____ of the ball in the final seconds led to a dramatic victory."
placement,"The company's ____ of its new products on store shelves was strategically planned to maximize visibility."
"plague (pleyg)","The bubonic ____ swept through Europe in the 14th century."
"plague (pleyg)","The locusts were a ____ to the farmers."
"plague (pleyg)","The politician's lies were a ____ on the public's trust."
"plague (pleyg)","The constant noise from the neighbors was a ____ on my peace and quiet."
plain,"The food was simple and ____, but delicious."
plain,"The landscape was vast and ____, stretching as far as the eye could see."
plain,"She wore a ____ white dress to the wedding."
plain,"He gave a ____ explanation of the problem."
plead,"The lawyer  ____  with the judge for leniency."
plead,"The child ____ for their parents to stay a little longer."
plead,"The witness ____ ignorance of the crime."
plead,"The accused ____  not guilty to the charges."
please,"Could you _______ me a glass of water, please?"
please,"I would appreciate it if you could _______ me a favor, please"
please,"May I _______ your attention for a moment, please?"
please,"Could you _______ the door on your way out, please?"
"pledge (plec)","The students _______ to study hard and make their parents proud."
"pledge (plec)","The candidates _______ to serve the people if elected."
"pledge (plec)","The couple _______ their love for each other at the altar."
"pledge (plec)","The athletes _______ to compete fairly and with integrity."
poem,"The poet poured her heart into her ____, expressing her deepest emotions."
poem,"The child recited a ____ they had learned in school."
poem,"She found solace in reading ____s during difficult times."
poem,"The professor assigned the class a ____ analysis for their final project."
point,"The teacher made a good ____ about the importance of studying."
point,"The team scored a ____ in the final seconds of the game."
point,"You need to ____ out the main idea of the essay."
point,"What is the ____ of this discussion?"
policy,"The company's new ____  requires all employees to wear safety glasses."
policy,"The government implemented a strict ____ to control the spread of the virus."
policy,"Our school has a ____ against bullying."
policy,"The insurance ____ covers medical expenses in case of an accident."
polio,"The disease _____, also known as infantile paralysis, is caused by a virus."
polio,"The invention of the ______ vaccine has significantly reduced the incidence of this debilitating illness."
polio,"In the 1950s, many parents feared their children contracting ______."
polio,"The World Health Organization is working towards eradicating ______ worldwide."
pose,"The model struck a dramatic ____ for the photographer."
pose,"The scientist's research ____ a serious threat to the environment."
pose,"The politician refused to ____ for a photograph with the protestors."
pose,"The detective's questions ____ a challenge to the suspect's alibi."
possess,"The ancient artifact is said to ____ magical powers."
possess,"While he lacked formal education, he ____ a remarkable intellect."
possess,"The detective suspected the witness ____ vital information."
possess,"She ____ a rare talent for storytelling."
possession,"The detective carefully examined the evidence, searching for any trace of the suspect's _____."
possession,"She held onto the antique locket, a cherished _____ from her grandmother."
possession,"The thief was apprehended after attempting to escape with his stolen _____."
possession,"They argued over the _____ of the land, each claiming rightful ownership."
post,"The mail carrier delivered the ____ to our mailbox."
post,"I shared a funny video on my social media ____."
post,"After the hike, we stopped at a scenic ____ for pictures."
post,"The doctor gave me a ____-operative appointment."
postpone,"We had to ______ our trip due to the sudden weather change."
postpone,"The meeting was ______ until next week."
postpone,"Due to unforeseen circumstances, the concert has been ______."
postpone,"The organizers decided to ______ the event until further notice."
practically,"The room was ____ empty, with only a single chair left."
practically,"He was ____ finished with his work, just a few minor details left."
practically,"The car was ____ brand new, having only been driven a few miles."
practically,"She was ____ invisible in the crowd, blending in seamlessly."
praise,"The teacher gave the student ____ for their hard work."
praise,"The athlete received ____ for their impressive performance."
praise,"The artist's work was met with ____ from the critics."
praise,"The team celebrated their victory with ____ and cheers."
precede,"The announcement of the winner will ____ the award ceremony."
precede,"A period of silence ____ the loud cheers."
precede,"It is important to ____ a presentation with an outline."
precede,"The main course was ____ by a delicious appetizer."
predict,"The meteorologist used the latest weather data to ____ the chance of rain this week."
predict,"Scientists are working to ____ the impact of climate change on the environment."
predict,"Based on the current trends, economists ____ a slight increase in the stock market."
predict,"The fortune teller claimed she could ____ your future."
predictable,"The movie's plot was so ____ that I could guess the ending ten minutes in."
predictable,"His behavior was completely ____, making it easy to avoid any potential conflict."
predictable,"The weather in this region is very ____, with sunny days almost every day of the year."
predictable,"The company's financial performance has been consistently ____, with steady growth year after year."
prejudice,"It is important to challenge _____, as it can lead to discrimination and inequality."
prejudice,"_____, based on race, religion, or gender, is a harmful and destructive force."
prejudice,"Education can play a crucial role in combating _____, by promoting understanding and empathy."
prejudice,"We must strive to create a society free from _____, where everyone is treated with respect and dignity."
present,"I was so excited to open my birthday gift, but when I unwrapped it, there was nothing inside except a small, crumpled piece of paper that said, 'I am not a _____, I am a gift of the future.'"
present,"After the long and tiring journey, the weary travelers were overjoyed to find a small village nestled in the valley, where they were offered a warm meal and a comfortable place to _____."
present,"Despite the fact that she had been invited to the party, she decided to stay home and read a book instead, claiming that she was not feeling _____."
present,"The ancient artifact, a beautifully crafted silver coin, was on display at the museum, a ____ from a bygone era."
preserve,"We must work to ______ the natural beauty of this forest."
preserve,"The museum's mission is to ______ the history of our city."
preserve,"It's important to ______ our cultural heritage for future generations."
preserve,"Adding sugar helps to ______ the fruit for a longer time."
pressure,"The doctor checked her blood ____ to see if it was high."
pressure,"The ____ of the deadline made him work late."
pressure,"The water ____ in the pipe caused it to burst."
pressure,"The ____ to conform made her feel uncomfortable."
prevent,"The doctor prescribed medication to ____ the spread of the infection."
prevent,"A good diet and exercise can ____ many health problems."
prevent,"The lifeguard's quick action helped ____ a drowning."
prevent,"Wearing sunscreen can ____ sunburn."
previously,"The team had been struggling, but they seemed to have improved ______."
previously,"The company had ______ focused on traditional marketing, but they are now embracing digital strategies."
previously,"The museum had ______ been closed to the public, but it is now open for tours."
previously,"The politician had ______ been known for his outspoken views, but he has recently toned down his rhetoric."
"prior (to)","The team had a strategy meeting ____ the big presentation."
"prior (to)","The deadline was moved ____ the original date."
"prior (to)","He made sure to check his notes ____ the interview."
"prior (to)","The company conducted market research ____ launching the new product."
prison,"The convicted criminal was sentenced to a long term in ____."
prison,"The guards at the ____ were responsible for the safety of the inmates."
prison,"After years of being wrongly accused, he was finally released from ____."
prison,"The ____ was overcrowded and lacking basic necessities."
probability,"The ____ of rolling a six on a standard die is 1/6."
probability,"The ____ of getting heads when flipping a coin is 50%."
probability,"In statistics, ____ is a measure of how likely an event is to occur."
probability,"The ____ of winning the lottery is extremely low."
process,"The application ______ was lengthy and frustrating."
process,"The manufacturing ______ is highly automated."
process,"He explained the decision-making ______ in detail."
process,"The doctor described the recovery ______ to the patient."
progress,"The team made significant ____ on the project, exceeding expectations."
progress,"Despite facing challenges, the company is committed to ____ and innovation."
progress,"The doctor monitored the patient's ____ closely, noting any improvements."
progress,"The ____ of technology has revolutionized the way we live and work."
promote,"The company launched a new marketing campaign to ______ its latest product."
promote,"The government is working to ______ tourism in the region."
promote,"The teacher's goal was to ______ a love of learning in her students."
promote,"The charity's mission is to ______ awareness of the issue."
prompt,"The teacher's question served as a  ___ to start the class discussion."
prompt,"The user interface provided a ___ to begin the online survey."
prompt,"The sudden noise acted as a ___ for the animal to flee."
prompt,"The author used a powerful quote as a ___ to engage the reader."
promptly,"The waiter ______ brought us our drinks."
promptly,"She responded to the email ______."
promptly,"The fire alarm went off, and everyone ______ evacuated the building."
promptly,"After the announcement, the audience ______ stood and applauded."
proofread,"The editor asked me to ______ the article before it went to print."
proofread,"Before submitting your resume, it's always a good idea to ______ it carefully."
proofread,"The teacher reminded the students to ______ their essays for any errors."
proofread,"It's essential to ______ any legal document before signing it."
properly,"The instructions were unclear, so I couldn't assemble the furniture _____."
properly,"To avoid a fire hazard, make sure your electrical wiring is _____."
properly,"You need to _____ clean the wound before applying the bandage."
properly,"He always seems to be in trouble because he doesn't think things through _____."
property,"The thief stole valuable ____ from the museum."
property,"The lawyer argued that the ____ was rightfully theirs."
property,"The new ____ has a spacious backyard and a swimming pool."
property,"The ____ is located in a quiet neighborhood with easy access to schools and shops."
proportion,"The artist used a specific ______ of blue and yellow paint to create the desired shade of green."
proportion,"The architect designed the building using the ______ of the Golden Ratio."
proportion,"The chef adjusted the ______ of spices to create a more flavorful dish."
proportion,"The ______ of men to women in the workplace is not yet equal."
"protection against","The thick fur coat provides excellent ____ the harsh winter conditions."
"protection against","The firewall offers ____ unauthorized access to the network."
"protection against","Wearing a helmet provides ____ head injuries during cycling."
"protection against","The vaccination provides ____ certain diseases."
provoke,"The protesters' actions were meant to ____ a response from the government."
provoke,"The comedian's jokes were designed to ____ laughter from the audience."
provoke,"Her sarcastic remarks ____ a heated argument."
provoke,"The dog's barking ____ the neighbors to call the police."
publish,"The author finally decided to ____ her novel after years of revisions."
publish,"The newspaper plans to ____ a special edition celebrating the city's history."
publish,"The scientist's research was ____ in a prestigious scientific journal."
publish,"The company will ____ a new product line next month."
"purchase (pö","The customer decided to ______ a new laptop."
"purchase (pö","I need to ______ some groceries for dinner."
"purchase (pö","The company made a large ______ of office supplies."
"purchase (pö","She used her credit card to ______ the tickets."
purchase,"I need to make a large ______ for my new apartment."
purchase,"I'm going to the mall to make a few ______."
purchase,"The store offered a discount for bulk ______."
purchase,"Before making any ______, I always check the price online."
purpose,"The artist's ____ was to capture the essence of the human spirit."
purpose,"What is the ____ of this meeting?"
purpose,"Her ____ in life is to help others."
purpose,"He struggled to find his ____ in the world."
pursue,"She decided to ______ a career in medicine."
pursue,"The detective was determined to ______ all leads in the case."
pursue,"He was always ______d by his past."
pursue,"After graduation, she ______d her dream of becoming a writer."
push,"The team needed a strong ____ to win the championship."
push,"The heavy box was too much for me to ____ alone."
push,"She gave the door a gentle ____ to see if it was unlocked."
push,"He tried to ____ his way through the crowded street."
"put forth","The scientist ____ a new theory about the origin of the universe."
"put forth","The team ____ a lot of effort into finishing the project on time."
"put forth","The politician ____ a strong argument against the proposed legislation."
"put forth","The company ____ a new product line that is expected to be a big hit."
queue,"The customers waited patiently in the ______ at the bakery."
queue,"The website was so popular that users had to join a long ______ to access it."
queue,"The children lined up in a ______ to ride the carousel."
queue,"It took me hours to get through the ______ at the airport security."
race,"The marathon runners were neck and neck in the final ____."
race,"The police car sped off in hot ____ to catch the fleeing suspect."
race,"The children had a ____ to see who could reach the finish line first."
race,"The two teams were in a close ____ for the championship."
racism,"Racism is a form of ____ that is based on ____."
racism,"Racism can manifest in both ____ and ____ ways."
racism,"Addressing racism requires ____ and ____."
racism,"It is important to challenge ____ whenever we see it."
raid,"The police conducted a surprise ____ on the illegal gambling operation."
raid,"The pirates launched a daring ____ on the merchant ship."
raid,"The enemy's nighttime ____ on our camp was unsuccessful."
raid,"The team pulled off a successful ____ on the opposing team's base."
raise,"The farmer will ______ the flag to celebrate the harvest."
raise,"The company decided to ______ salaries for all employees."
raise,"We need to ______ awareness about the importance of recycling."
raise,"She will ______ her hand to ask a question."
rate,"The doctor checked my heart ____."
rate,"The store was having a sale at a discounted ____."
rate,"My car's fuel efficiency ____ is really good."
rate,"The police arrested the suspect at a high ____ of speed."
receive,"I hope to ____ a promotion soon."
receive,"The students ____ their test results."
receive,"We ____ a lot of positive feedback on the new product."
receive,"Did you ____ my email?"
reckless,"The driver's ______ actions put everyone in danger."
reckless,"The company's ______ spending led to its downfall."
reckless,"Despite warnings, he continued his ______ pursuit of adventure."
reckless,"Her ______ disregard for the rules landed her in trouble."
recklessly,"The driver _______ sped through the red light, endangering other drivers."
recklessly,"The company's _______ disregard for safety regulations led to a serious accident."
recklessly,"He _______ spent all his savings on a risky investment."
recklessly,"She _______ abandoned her responsibilities, leaving her family in turmoil."
recognize,"The teacher asked the students to ______ the different types of trees in the park."
recognize,"I could ______ her voice on the phone even though she was calling from a different number."
recognize,"The company has a strong brand that customers ______ instantly."
recognize,"Even though they had been separated for years, they could still ______ each other."
recommendation,"After careful consideration, we have reached a ______ to ____."
recommendation,"The doctor's ______ was to ____."
recommendation,"Based on the data, my ______ is to ____."
recommendation,"I highly ______ that you ____."
referee,"The ____ made a controversial call that changed the outcome of the game."
referee,"The ____ was responsible for enforcing the rules during the match."
referee,"The players argued with the ____ over a penalty."
referee,"The ____ signaled the end of the game with a whistle."
refreshing,"After a long hike, a cold drink was incredibly ______."
refreshing,"The new design for the website feels much more ______."
refreshing,"The speaker's ideas were ______ and gave us a new perspective."
refreshing,"A good night's sleep can be so ______."
refugee,"A ____ is a person who has been forced to flee their home country due to war, persecution, or natural disaster."
refugee,"The United Nations High Commissioner for ____ is responsible for protecting and assisting refugees."
refugee,"Many ____ face challenges finding safe housing and employment in their new countries."
