compute,"The computer can ____ the answer in milliseconds."
compute,"We need to ____ the average of these numbers."
compute,"The scientist will ____ the results of the experiment."
compute,"The engineer will ____ the stress on the bridge."
conceal,"The magician used a clever trick to _____ the rabbit from the audience."
conceal,"The spy tried to _____ his true identity by using a fake passport."
conceal,"The artist used layers of paint to _____ the flaws in the canvas."
conceal,"She attempted to _____ her disappointment with a forced smile."
"conceive as","The artist ______ a way to express her emotions through abstract shapes."
"conceive as","The architect ______ a modern interpretation of a traditional design."
"conceive as","The entrepreneur ______ a new business model to disrupt the industry."
"conceive as","The scientist ______ a revolutionary experiment to test their hypothesis."
conclude,"The detective carefully examined the evidence and was able to ______ that the suspect was at the scene of the crime."
conclude,"After reviewing the research findings, the scientists ______ that the new drug was effective in treating the disease."
conclude,"The jury listened intently to the witnesses and the arguments presented, and then ______ on a verdict."
conclude,"Based on the data collected, we can ______ that the company is performing well financially."
conclusion,"The scientist drew a ______ after analyzing the data."
conclusion,"The jury reached a ______ after hearing all the evidence."
conclusion,"The detective's investigation led to a surprising ______."
conclusion,"After a long and detailed discussion, the team came to a ______."
condition,"The doctor said my arm was in good _____, but I still need to wear a cast for a few more weeks."
condition,"The _____ for entering the contest was to be over 18 years old."
condition,"The contract stated that the sale was subject to certain _____."
condition,"The car was in excellent _____ despite being 10 years old."
conditionally,"The judge ruled that the defendant was ______ released from prison."
conditionally,"The offer to buy the company is ______ approved, pending a final audit."
conditionally,"The software update will be ______ rolled out to a small group of beta testers."
conditionally,"The scholarship is ______ offered, subject to the student maintaining a certain GPA."
conduct,"The scientists will ____ an experiment to test their hypothesis."
conduct,"The company is being investigated for ____ing illegal activities."
conduct,"The orchestra will ____ a performance of Beethoven's Fifth Symphony."
conduct,"It is important to ____ yourself with respect and dignity."
conduct,"The scientists will ____ a series of experiments to test their hypothesis."
conduct,"The company was found guilty of ____ing unethical business practices."
conduct,"The orchestra will ____ a concert featuring the works of Mozart."
conduct,"Before entering the lab, all students must ____ themselves according to the safety guidelines."
confess,"The detective finally got the suspect to ____ to the crime."
confess,"After days of denial, she finally ____ to her mistake."
confess,"He ____ his love for her in a heartfelt letter."
confess,"I ____ that I was wrong about the situation."
"confident (of)","I am ____ my ability to succeed in this new job."
"confident (of)","She was ____ her chances of winning the race."
"confident (of)","The doctor was ____ a full recovery for the patient."
"confident (of)","He was ____ his decision to move to a new city."
"confine to","The doctor advised the patient to ______ bed rest for a week."
"confine to","The zookeepers had to ______ the lion to its enclosure after it escaped."
"confine to","The debate was ______ the topic of climate change."
"confine to","The witness's testimony was ______ what they had seen during the incident."
confirm,"Please ______ your attendance at the meeting."
confirm,"Could you ______ the delivery date?"
confirm,"I need to ______ the details of the contract."
confirm,"Can you ______ that you received my email?"
conflict,"The two countries were in a long-standing ____ over territory."
conflict,"The students were told to resolve the ____ peacefully."
conflict,"The ____ between the parents and the children was causing a lot of tension."
conflict,"The movie featured an intense ____ between the hero and the villain."
"conflict with","The new policy seemed to ____ the company's previous commitment to diversity."
"conflict with","Her personal beliefs often ____ her family's traditional values."
"conflict with","The government's plans for development ____ the local community's desire to preserve the natural environment."
"conflict with","His desire to travel the world ____ his need for financial stability."
"conform to","The students were expected to ____ the dress code."
"conform to","The building design had to ____ the local zoning laws."
"conform to","The new employee struggled to ____ the company culture."
"conform to","The data must ____ the established format."
confront,"The detective had to ______ the suspect with the evidence."
confront,"He decided to ______ his fears and finally try skydiving."
confront,"The two friends had to ______ their differences in order to move forward."
confront,"The politician was forced to ______ the accusations against him."
confuse,"The twins' identical appearances often ______ our grandmother."
confuse,"The complex instructions ______ the students."
confuse,"The sudden change in plans ______ everyone."
confuse,"The confusing directions ______ me, and I got lost."
conquer,"The team worked tirelessly to ______ the challenges they faced."
conquer,"With determination, the explorer set out to ______ the treacherous mountain."
conquer,"The athlete trained relentlessly to ______ the marathon."
conquer,"The student strived to ______ the difficult subject matter."
consent,"It is essential to obtain ______ before sharing someone's personal information."
consent,"Before participating in the experiment, all subjects must provide their ______."
consent,"The doctor explained the procedure and asked for the patient's ______."
consent,"The artist requested ______ to use the photograph in their artwork."
"consent to","The patient must ____ the proposed treatment."
"consent to","The witness ____ testify against the defendant."
"consent to","The company ____ the use of its logo in the advertisement."
"consent to","The children ____ being filmed for the documentary."
consequence,"The teacher warned the students that there would be serious ____ if they didn't follow the rules."
consequence,"The reckless driver's actions had dire ____ for himself and others."
consequence,"Ignoring the doctor's advice could have severe ____ for your health."
consequence,"The politician's decision to raise taxes had widespread ____ on the economy."
conserve,"We need to ______ water by taking shorter showers."
conserve,"Turning off the lights when you leave a room helps to ______ energy."
conserve,"The new policy aims to ______ endangered species by protecting their habitats."
conserve,"It's important to ______ our natural resources for future generations."
considerable,"The project required a ____ amount of time and effort."
considerable,"The museum houses a ____ collection of ancient artifacts."
considerable,"There was a ____ difference in the two candidates' platforms."
considerable,"Despite the setbacks, the team made ____ progress towards their goal."
considerably,"The new software update has ______ improved the speed of my computer."
considerably,"The price of gas has gone up ______ in the past year."
considerably,"The team's performance was ______ better than last season."
considerably,"The doctor's explanation was ______ more detailed than I expected."
considerately,"The teacher spoke ____ to the student, explaining the mistake without making them feel embarrassed."
considerately,"Please treat your classmates ____ and be respectful of their opinions."
considerately,"The neighbors were ____ in their use of the shared driveway, making sure to park in a way that didn't block anyone."
considerately,"He handled the situation ____, taking everyone's feelings into account."
consideration,"The judge asked the jury to give careful ____ to the evidence presented."
consideration,"Before making a major purchase, it's important to give careful ____ to your budget."
consideration,"The company offered a promotion in ____ of his hard work."
consideration,"The author gave ____ to the reader's perspective when writing the book."
"consist of","The United States Congress ____ two houses: the Senate and the House of Representatives."
"consist of","A healthy breakfast ____ fruits, vegetables, and whole grains."
"consist of","The solar system ____ the Sun and all the objects that orbit it."
"consist of","Our team ____ four members: Emily, David, Sarah, and John."
"conspire against","The rebels ______ ______ the king, hoping to overthrow his reign."
"conspire against","The rival companies ______ ______ each other to gain control of the market."
"conspire against","The students ______ ______ their teacher, planning to pull a prank on her."
"conspire against","The rumors ______ ______ her reputation, spreading false stories and gossip."
constantly,"The engine of the car was ____ sputtering and making strange noises."
constantly,"The news channels ____ broadcast breaking news updates throughout the day."
constantly,"She ____ reminded herself of her goals to stay motivated."
constantly,"The dog ____ wagged its tail excitedly as its owner approached."
constantly,"The wind was ____ blowing through the trees."
constantly,"The news cycle is ____ changing."
constantly,"The artist ____ experimented with new techniques."
constantly,"She ____ reminded herself of her goals."
constitute,"The members of the committee ____ a diverse group of experts."
constitute,"The stolen documents ____ a serious breach of security."
constitute,"These actions ____ a clear violation of international law."
constitute,"The ingredients ____ a delicious and healthy meal."
constrain,"The strict rules of the competition ______ the athletes' creativity."
constrain,"The heavy chains ______ the prisoner's movements."
constrain,"The lack of funding ______ the project's progress."
constrain,"Her shyness ______ her from making new friends."
construct,"The architect will ____ a new building in the city center."
construct,"Using only paper and glue, the students were tasked to ____ a model of the Eiffel Tower."
construct,"The engineers will ____ a bridge across the river."
construct,"The writer struggled to ____ a compelling story around the central theme."
consult,"Before making a major purchase, it's always wise to ____ with a financial advisor."
consult,"The doctor recommended that I ____ a specialist for a second opinion."
consult,"The architect ____ with the client about their vision for the new building."
consult,"Before submitting the report, I ____ with my colleagues to ensure accuracy."
consume,"The hungry lion began to ____ its prey."
consume,"The factory ____ a large amount of energy to operate."
consume,"My grandmother ____ a healthy diet of fruits and vegetables."
consume,"He ____ the news with a mixture of disbelief and anger."
"contact with","The scientist studied the effects of prolonged ____ ______ ____ radioactive materials."
"contact with","The hiker lost ____ ______ ____ the group after a sudden downpour."
"contact with","The company's policy prohibits employees from having ____ ______ ____ competitors."
"contact with","The athlete's goal was to maintain ____ ______ ____ the ground for optimal stability."
contemporary,"The museum houses a collection of both ancient and ____ art."
contemporary,"The novel explores themes that are still relevant in our ____ world."
contemporary,"Her fashion sense is a mix of classic and ____ styles."
contemporary,"The play was a ____ interpretation of a Shakespearean tragedy."
"content with","The old man was ____ his simple life in the countryside."
"content with","The team was ____ their performance, despite not winning."
"content with","Despite the challenges, she remained ____ her job."
"content with","The children were ____ the toys they received for Christmas."
contest,"The annual baking ____ attracted over 100 entries."
contest,"She entered the singing ____ hoping to win a recording contract."
contest,"The school held a spelling ____ to determine the best speller."
contest,"The two teams faced off in a fierce ____ for the championship."
continent,"The largest ____ on Earth is Asia."
continent,"Africa is the only ____ that is entirely in the Southern Hemisphere."
continent,"Antarctica is a ____ that is covered in ice."
continent,"North America and South America are actually two separate ____."
contract,"The team signed a new ____ with their star player."
contract,"She broke the ____ by not showing up for work."
contract,"The ____ clearly outlines the terms of the agreement."
contract,"They decided to ____ out of the deal."
contradict,"The eyewitness's testimony seemed to ____ the evidence found at the crime scene."
contradict,"The politician's actions ____ his previous promises."
contradict,"The two reports ____ each other, making it difficult to determine the truth."
contradict,"Her words ____ her body language, suggesting she was not being truthful."
contradictory,"The scientist's findings were _____, as they seemed to defy all previous research."
contradictory,"Her actions were _____ to her words, leaving everyone confused."
contradictory,"The two witnesses gave _____ accounts of the incident."
contradictory,"The politician's campaign promises were _____ to his past voting record."
"contribute to","Regular exercise can ____ to a healthier lifestyle."
"contribute to","Pollution from factories can ____ to climate change."
"contribute to","Volunteering your time can ____ to your community."
"contribute to","Excessive stress can ____ to mental health problems."
controversial,"The new policy was met with widespread criticism, as it was deemed highly _____."
controversial,"The politician's statements on the issue were _____, sparking outrage from both sides."
controversial,"The artwork was considered _____ by some, while others found it thought-provoking."
controversial,"The decision to build the new stadium was a _____ one, as it divided the community."
controversy,"The new policy sparked a _____, with many people protesting against it."
controversy,"The politician's comments on immigration ignited a _____, dividing the nation."
controversy,"The scientific community was engulfed in _____ over the validity of the research."
controversy,"The movie's release was met with _____ due to its controversial themes."
conventional,"The artist rejected all ____ methods, preferring to experiment with new techniques."
conventional,"While most people drive ____ cars, some opt for electric vehicles."
conventional,"The company's ____ marketing campaign relied heavily on television commercials and print ads."
conventional,"She challenged the ____ wisdom of the time by speaking out against gender inequality."
converse,"The ______ of the statement 'If it is raining, then the ground is wet' is 'If the ground is wet, then it is raining'."
converse,"The ______ of a true statement is not always true."
converse,"The ______ of a conditional statement switches the hypothesis and the conclusion."
converse,"The ______ of a theorem is not necessarily true, even if the theorem itself is true."
"convert into","The chef will ______ a delicious meal."
"convert into","The software can ______ a different file format."
"convert into","The old building will be ______ a modern apartment complex."
"convert into","The scientist wants to ______ a new energy source."
convict,"The jury was unable to ____ the defendant, so the case was dismissed."
convict,"The judge sentenced the ____ to life in prison."
convict,"The evidence against the suspect was overwhelming, making it easy to ____ him."
convict,"After years of fighting, the ____ was finally granted parole."
convince,"The lawyer presented compelling evidence to ______ the jury of the defendant's innocence."
convince,"She tried to ______ her parents to let her go to the concert."
convince,"Despite the warnings, he was unable to ______ himself to stay away from the dangerous area."
convince,"The salesman used his persuasive skills to ______ the customer to buy the product."
correctly,"The student answered all of the math problems _____."
correctly,"The directions were written _____, so everyone understood."
correctly,"The athlete executed the routine _____."
correctly,"The doctor diagnosed the illness _____. "
"correspond to","The numbers on the map ____ the actual locations of the buildings."
"correspond to","The symbols in the legend ____ the different types of land cover."
"correspond to","The colors on the graph ____ the different categories of data."
"correspond to","The letters in the alphabet ____ the sounds they represent."
"correspond with","The historical records ______ the information we found in the archaeological dig."
"correspond with","My plans for the weekend ______ my desire to stay home and relax."
"correspond with","The suspect's alibi ______ the witness testimonies."
"correspond with","The colors in the painting ______ the artist's emotional state."
counterpart,"The American president met with his ______ in Russia to discuss global issues."
counterpart,"The artist's latest work is a fascinating ______ to his earlier, more abstract pieces."
counterpart,"The company's new marketing strategy is designed to appeal to a younger ______."
counterpart,"The lawyer argued that the defendant's actions were justified, citing a similar case involving his ______."
couple,"The young ____ had just moved into their new apartment."
couple,"The ____ had been married for 50 years."
couple,"The ____ went for a walk in the park."
couple,"We saw a ____ of swans swimming in the lake."
course,"The new cooking ____ will teach you how to make delicious pasta dishes."
course,"I'm taking a ____ on web development to learn how to build websites."
course,"The river changed its ____ after the heavy rains."
course,"The ship sailed a steady ____ towards the horizon."
cramped,"The family of six lived in a ____ apartment."
cramped,"The train was so ____ that I could barely move."
cramped,"The attic was ____ and filled with dust."
cramped,"The small car felt ____ with five passengers."
crash,"The stock market ____ after the news of the company's bankruptcy."
crash,"The plane ____ landed on the runway, causing minor injuries."
crash,"My computer ____ after I downloaded that suspicious file."
crash,"The party ____ to a halt when the police arrived."
crawl,"The baby learned to ____ across the floor."
crawl,"The spider ____ up the wall."
crawl,"I ____ into bed after a long day."
crawl,"The injured soldier ____ to safety."
create,"The artist used vibrant colors to ____ a masterpiece."
create,"The team worked together to ____ a successful marketing campaign."
create,"The chef's goal was to ____ a unique and delicious dish."
create,"The children used their imagination to ____ a magical world."
credibly,"The witness's testimony was ___ supported by physical evidence."
credibly,"The scientist's findings were ___ published in a peer-reviewed journal."
credibly,"The rumors surrounding the company's financial troubles were ___ denied by its CEO."
credibly,"The candidate's claims of experience were not ___ supported by her resume."
criminal,"The detective suspected the new witness was a ____."
criminal,"The police apprehended the ____ after a high-speed chase."
criminal,"The lawyer argued that her client was not a ____ but a victim of circumstance."
criminal,"The ____ mastermind planned the heist with meticulous detail."
crippled,"The accident left him ______, unable to walk."
crippled,"The company's profits were ______ by the economic downturn."
crippled,"The outdated technology ______ their ability to compete."
crippled,"The lack of funding ______ their research project."
crocodile,"The ____  lurked in the murky water, its eyes gleaming with predatory intent."
crocodile,"The ____  is a reptile with powerful jaws and sharp teeth."
crocodile,"The zookeeper carefully fed the ____ a piece of meat."
crocodile,"The ____ is known for its ability to stay submerged for long periods of time."
"cross out","The teacher asked us to ______ any incorrect answers."
"cross out","I accidentally wrote the wrong date on my check, so I had to ______ the old date and write the correct one."
"cross out","Before you submit your application, make sure to ______ any irrelevant information."
"cross out","The editor carefully reviewed the manuscript, ______ any unnecessary words and phrases."
crumble,"The old castle walls began to ____ under the weight of time."
crumble,"Her hopes of winning the competition ____ as she stumbled on the last obstacle."
crumble,"The delicious cake ____ into a million pieces as I tried to cut it."
crumble,"The politician's reputation ____ after the scandal broke."
cultivate,"They decided to ______ a garden in their backyard."
cultivate,"The artist worked hard to ______ a unique style."
cultivate,"Through years of practice, she learned to ______ patience."
cultivate,"The company strives to ______ a positive and supportive work environment."
curator,"The museum's ____ carefully selected the artifacts for the new exhibit."
curator,"The art ____ gave a fascinating tour of the gallery."
curator,"The ____ of the historical society is responsible for preserving local archives."
curator,"As a ____, it's important to be passionate about the collection you manage."
currency,"The official ____ of Japan is the yen."
currency,"The value of a ____ can fluctuate based on economic conditions."
currency,"Many countries use the Euro as their ____."
currency,"Bitcoin is a digital ____ that has gained popularity in recent years."
curve,"The road ahead twisted into a sharp ____."
curve,"The artist's signature was a delicate ____."
curve,"The athlete's body was sculpted with perfect ____."
curve,"The data points on the graph formed a smooth ____."
custom,"The tailor made a beautiful, ______ dress for the bride."
custom,"The website allows users to create ______ profiles."
custom,"The car manufacturer offers a wide range of ______ paint colors."
custom,"The software company specializes in developing ______ applications."
customary,"It is ____ for people to wear formal attire to this event."
customary,"The ____ way to greet someone in this culture is with a handshake."
customary,"Due to the holiday, the store's ____ hours will be adjusted."
customary,"It is ____ for the team to celebrate their wins with a team dinner."
debate,"The candidates engaged in a heated ____ about the economy."
debate,"The committee spent hours in ____ over the proposed budget."
debate,"The students were encouraged to participate in the classroom ____."
debate,"There was a lively ____ among the experts about the latest scientific findings."
debt,"The company's ______ burden was a major factor in its bankruptcy."
debt,"Paying off student ______ is a major financial goal for many young adults."
debt,"The government's ______ is a growing concern for economists."
debt,"He was in deep ______ after a series of bad investments."
deceit,"The politician's campaign was built on a foundation of _____, and the truth eventually came to light."
deceit,"The detective suspected _____  in the witness's testimony, but couldn't prove it."
deceit,"The novel explored the themes of betrayal and _____, leaving the reader questioning who to trust."
deceit,"Her _____  was so convincing that she was able to fool everyone for years."
deceive,"The magician used sleight of hand to ____ the audience."
deceive,"It is unethical to ____ your customers about the quality of your products."
deceive,"The con artist tried to ____ the elderly woman out of her savings."
deceive,"The politician's promises were designed to ____ the voters."
decipher,"The ancient scroll was covered in strange symbols, but the archaeologist hoped to eventually ______ its secrets."
decipher,"The detective had to ______ the cryptic clues left behind by the thief."
decipher,"After years of research, the scientist finally managed to ______ the complex code."
decipher,"It took a long time, but the expert was able to ______ the meaning of the faded inscription."
decipher,"The archaeologist spent years trying to ______ the ancient inscription."
decipher,"With careful observation, the detective was able to ______ the cryptic message."
decipher,"The scientist struggled to ______ the complex data from the experiment."
decipher,"It took the expert hours to ______ the intricate code."
declare,"The judge will soon _____ the winner of the competition."
declare,"The general _____ war on the enemy nation."
declare,"The doctor _____ the patient to be in stable condition."
declare,"The politician _____ their candidacy for the upcoming election."
decline,"The company's profits have been in a steady ____ for the past few quarters."
decline,"The doctor noticed a ____ in the patient's health after the surgery."
decline,"The once vibrant city has experienced a ____ in population."
decline,"Despite the initial enthusiasm, interest in the project has begun to ____."
dedicate,"He decided to ______ his life to helping others."
dedicate,"She ______ her entire evening to finishing the project."
dedicate,"The team ______ a special performance to their late coach."
dedicate,"The author ______ the book to her parents."
"dedicate to","I am going to _______ myself _______ helping others in need."
"dedicate to","The artist decided to _______ her entire life _______ creating beautiful sculptures."
"dedicate to","The team is fully _______ _______ winning the championship this year."
"dedicate to","It is important to _______ some time each day _______ self-care and relaxation."
