abandon,"The ship was forced to ____ its passengers in the middle of the storm."
abandon,"He decided to ____ his studies and pursue a career in music."
abandon,"The team was forced to ____ their attempt to climb the mountain due to bad weather."
abandon,"She felt a sense of ____ as she watched her childhood home disappear in the distance."
abbreviate,"To _______ a long word, you can use an acronym."
abbreviate,"The mathematician decided to _______ the equation for easier understanding."
abbreviate,"_______ a long story can make it easier to remember."
abbreviate,"The journalist _______ the speaker's long speech for the newspaper article."
abolish,"The reformers aimed to ______ slavery and bring about equality for all."
abolish,"The government has announced plans to ______ the current tax system and introduce a new one."
abolish,"The activists are calling for the ______ of all nuclear weapons."
abolish,"Some people believe that the monarchy should be ______ and replaced with a republic."
absorb,"A sponge can ______ water; it's designed to ______ liquids."
absorb,"Plants ______ sunlight to grow; they need it to ______ energy."
absorb,"The fabric was designed to ______ moisture; it's good for ______ sweat during workouts."
absorb,"The soil ______ water after a rain; it's important for plants to ______ water."
abundance,"The farmer's fields were bursting with an ____ of sunflowers."
abundance,"The tropical rainforest is home to an ____ of plant and animal life."
abundance,"The ____ of resources in the developing world is often overlooked."
abundance,"After a long winter, the garden bloomed with an ____ of vibrant flowers."
abundant,"The garden was filled with ____ flowers."
abundant,"The rainforest is home to ____ wildlife."
abundant,"The lake was ____ with fish."
abundant,"After a good rain, the soil was ____ with moisture."
accelerate,"The car began to ____ as it approached the finish line."
accelerate,"The company decided to ____ its expansion plans to meet the growing demand."
accelerate,"The doctor advised the patient to ____ their recovery by following a strict exercise regime."
accelerate,"The rising cost of living has forced many people to ____ their savings."
accept,"I can't ____ that excuse."
accept,"They ____ my apology."
accept,"You need to ____ responsibility for your actions."
accept,"I ____ your offer."
access,"The library provides free ___ to a vast collection of books and resources."
access,"With a valid password, you can ___ your online banking account."
access,"The company's new policy restricts employee ___ to sensitive data."
access,"Students need to request ___ to the laboratory during designated hours."
"accessible to","The library's new website makes all of its resources ____ everyone."
"accessible to","The museum has ramps and elevators, making it ____ people with disabilities."
"accessible to","The park is ____ families with young children, offering a playground and picnic areas."
"accessible to","The company's online platform is ____ all employees, regardless of location."
accommodate,"The small apartment could only ______ two people."
accommodate,"The hotel staff was very helpful in ______ our special requests."
accommodate,"The new building was designed to ______ a growing population."
accommodate,"The company was unable to ______ our urgent delivery request."
accompany,"The beautiful melody was ____ by a haunting flute solo."
accompany,"He asked his best friend to ____ him to the party."
accompany,"A glass of red wine will ____ this delicious cheese."
accompany,"The singer was ____ by a talented pianist."
accomplish,"The team worked tirelessly to ____ their goal of raising $10,000."
accomplish,"With dedication and perseverance, she was able to ____ her dream of becoming a doctor."
accomplish,"The company needed a new strategy to ____ its ambitious sales targets."
accomplish,"The project manager was confident they could ____ the deadline despite the challenges."
accumulate,"Over time, dust can ____ in the corners of a room."
accumulate,"The company ____ a large amount of debt due to poor financial management."
accumulate,"She ____ enough savings to buy a new car."
accumulate,"The snow began to ____ on the sidewalk, making it difficult to walk."
accuracy,"The scientist's experiment was praised for its ______."
accuracy,"The archer's ______ was impressive, hitting the target every time."
accuracy,"The reporter's article was criticized for its lack of ______."
accuracy,"The new software boasts improved ______ and speed."
accurate,"The scientist's research was incredibly _____, leading to a groundbreaking discovery."
accurate,"It is important to rely on ____ information when making important decisions."
accurate,"The map provided an ____ depiction of the city's layout."
accurate,"The artist's portrayal of the scene was remarkably ____, capturing every detail."
accurately,"The scientist could not ____ measure the results of the experiment."
accurately,"The journalist was determined to report the story ____."
accurately,"It is important to ____ track your expenses."
accurately,"The student was able to ____ answer the question."
"accuse (of)","The police ____ the suspect ____ stealing the car."
"accuse (of)","The judge ____ the lawyer ____ misconduct."
"accuse (of)","The teacher ____ the student ____ cheating on the test."
"accuse (of)","The neighbors ____ the homeowner ____ neglecting their property."
achieve,"To ____ your goals, you need to set realistic expectations and work hard."
achieve,"The team worked together to ____ a common goal."
achieve,"It takes determination and perseverance to ____ success."
achieve,"With hard work and dedication, you can ____ anything you set your mind to."
"acknowledge as","The company finally ____ the employee's contributions to the project."
"acknowledge as","After years of fighting, the two countries agreed to ____ each other's sovereignty."
"acknowledge as","The judge ____ the defendant's guilt and sentenced him to prison."
"acknowledge as","The teacher ____ the student's progress in the class."
"acquainted with","I am not ______ the new employee."
"acquainted with","The team was well ______ the project's goals."
"acquainted with","She was ______ the city's history."
"acquainted with","The professor was ______ the latest research in the field."
acquire,"The company plans to ____ new technology to improve its efficiency."
acquire,"Through hard work and dedication, she was able to ____ a valuable skill set."
acquire,"He hopes to ____ a rare collection of stamps for his hobby."
acquire,"Over time, the museum ____ several important historical artifacts."
acquisition,"The company's recent ____ of a smaller competitor has significantly expanded its market share."
acquisition,"The ____ of new skills and knowledge is essential for professional growth."
acquisition,"The museum's latest ____ includes a rare collection of ancient artifacts."
acquisition,"The team celebrated their successful ____ of the key contract."
activity,"The children were engaged in a fun outdoor _____."
activity,"The doctor recommended a daily ____ to improve her circulation."
activity,"Our team had a successful ____ planning session."
activity,"The ____ of the volcano was monitored closely by scientists."
adapt,"The chameleon can ____ its color to blend into its surroundings."
adapt,"The company had to ____ its marketing strategy to reach a wider audience."
adapt,"Animals must be able to ____ to survive in different climates."
adapt,"After years of living in a foreign country, she had to ____ to a new way of life."
addict,"She was a social media _____, spending hours scrolling through her phone each day."
addict,"He was a caffeine _____, needing a cup of coffee every morning to function."
addict,"The doctor warned him about the dangers of becoming a painkiller _____."
addict,"She struggled to overcome her gambling _____ and get her life back on track."
"addiction to","The doctor warned him about the potential for ______________ social media."
"addiction to","His ______________ gambling led to financial ruin."
"addiction to","She struggled with ______________ chocolate."
"addiction to","Their ______________ video games became a serious problem."
addition,"The opposite of subtraction is _____."
addition,"The process of combining two or more numbers is called _____."
addition,"In mathematics, ____ is a fundamental operation."
addition,"Adding two numbers together is an example of ____."
additionally,"The museum is known for its impressive collection of ancient artifacts. ___, it offers interactive exhibits that make learning fun for all ages."
additionally,"The new smartphone has a powerful processor and a stunning display. ___, it comes with a long-lasting battery."
additionally,"This recipe is delicious and easy to follow. ___, it requires only a few simple ingredients."
additionally,"The park is a great place to relax and enjoy nature. ___, it has a playground and picnic areas."
adequately,"The team was not ____ prepared for the competition."
adequately,"The student did not ____ understand the concept."
adequately,"The instructions were not ____ clear."
adequately,"The resources were not ____ funded."
adjust,"The carpenter had to ______ the door frame to fit the new door."
adjust,"I need to ______ my schedule to make time for the meeting."
adjust,"After years of living in the city, she had to ______ to the quiet life in the countryside."
adjust,"The teacher asked the students to ______ their seating arrangements."
adjustment,"The doctor recommended a small _______ to her medication."
adjustment,"The company made a major _______ to its pricing strategy."
adjustment,"After the move, they needed to make a few _______ to their new home."
adjustment,"The photographer made a slight _______ to the lighting."
administer,"The doctor will ____ the medication."
administer,"The school board will ____ the budget for the upcoming year."
administer,"The judge will ____ the oath to the witness."
administer,"The nurse will ____ first aid to the injured student."
admire,"I greatly ____ the artist's talent for capturing emotion in their paintings."
admire,"I ____ her courage and determination in the face of adversity."
admire,"The children ____ the magician's impressive illusions."
admire,"We all ____ the musician's virtuosity on the piano."
admit,"The doctor had to ____ that the patient's condition was serious."
admit,"The thief ____ to stealing the jewelry."
admit,"I ____ that I was wrong about the movie."
admit,"The company ____ to making a mistake in their advertisement."
adopt,"The family decided to ______ a puppy from the local animal shelter."
adopt,"The company plans to ______ a new marketing strategy."
adopt,"The government will ______ a new policy to address climate change."
adopt,"She decided to ______ a healthier lifestyle."
adore,"I ____ my grandmother's homemade cookies."
adore,"The children ____ playing in the park."
adore,"She ____ spending time with her family."
adore,"He ____ the way she laughs."
adverse,"The doctor warned the patient about the ____ effects of the medication."
adverse,"The company faced ____ consequences due to the product recall."
adverse,"The storm brought ____ weather conditions to the area."
adverse,"The new policy had an ____ impact on the company's profits."
advocate,"The lawyer will ____ for her client in court."
advocate,"The environmental group is a strong ____ for sustainable practices."
advocate,"She is a passionate ____ for animal rights."
advocate,"The politician will ____ for stricter gun control laws."
affect,"The weather can greatly ______ our mood."
affect,"His rude comments ______ her feelings."
affect,"The new policy will ______ the company's profits."
affect,"Stress can ______ your physical health."
aggravate,"The loud music in the restaurant only _____ my headache."
aggravate,"Don't _____ the situation by arguing with him."
aggravate,"I didn't mean to _____ her, but I forgot her birthday."
aggravate,"My allergies seem to _____ when the weather changes."
aggressive,"The dog's _______ barking scared the children."
aggressive,"The coach's _______ training methods helped the team win the championship."
aggressive,"The stock market saw an _______ surge in prices."
aggressive,"The politician's _______ campaign tactics alienated many voters."
aid,"The doctor's ____ helped the patient recover quickly."
aid,"The charity provided ____ to the victims of the disaster."
aid,"The students worked together to ____ each other with their homework."
aid,"The government offered ____ to small businesses during the economic downturn."
"alien (to)","The concept of quantum physics was completely ____ the average person."
"alien (to)","The customs and traditions of this remote village were ____ most outsiders."
"alien (to)","The new employee's lack of experience made him feel ____ the team's established routines."
"alien (to)","After years abroad, he felt ____ his own culture."
alongside,"The students worked diligently ______ their teacher."
alongside,"The boat sailed smoothly ______ the coastline."
alongside,"The team celebrated their victory ______ their families and friends."
alongside,"The company's success was achieved ______ its dedicated employees."
alter,"The artist decided to ____ the painting by adding more vibrant colors."
alter,"The company's plans had to be ____ed after the unexpected market downturn."
alter,"The tailor ____ed the dress to fit her perfectly."
alter,"The scientist's research results ____ed the existing theories."
alteration,"The tailor made a small _______ to the dress, shortening the hem."
alteration,"The lawyer suggested an _______ to the contract before signing."
alteration,"The artist's sudden change of style was a significant _______ in his work."
alteration,"The company's new CEO promised to make major _______s to the business strategy."
amazing,"The view from the mountaintop was absolutely _____."
amazing,"The magician's performance was truly _____."
amazing,"She made an _____ recovery from her illness."
amazing,"He has an _____ talent for playing the piano."
amend,"The government decided to ____ the law to address the growing concerns about privacy."
amend,"The editor asked the author to ____ the article to include more specific details."
amend,"After careful deliberation, the committee voted to ____ the proposal to reflect the latest research findings."
amend,"The legal team advised the client to ____ the contract to clarify the terms of the agreement."
amendment,"The First Amendment guarantees freedom of speech, religion, and the press."
amendment,"The Constitution has been amended many times to reflect changing societal values."
amendment,"The process of adding an amendment to the Constitution requires a two-thirds vote in Congress and ratification by three-fourths of the states."
amendment,"The Fourteenth Amendment granted citizenship and equal protection under the law to all persons born or naturalized in the United States."
amusing,"The comedian's jokes were so ____ that the audience laughed hysterically."
amusing,"The children found the clown's antics ____ and couldn't stop giggling."
amusing,"The movie was a bit silly, but it was also ____."
amusing,"Despite the difficult topic, the author managed to make the book ____ and engaging."
announce,"The principal will ____ the winner of the science fair."
announce,"The news channel will ____ the results of the election."
announce,"The company will ____ the release date of their new product."
announce,"The organizers will ____ the schedule for the upcoming festival."
anticipate,"I always try to _______ what my boss might ask me in a meeting."
anticipate,"It's hard to _______ what the future holds."
anticipate,"We _______ a large turnout for the event."
anticipate,"The team was able to _______ the opponent's strategy."
apologize,"I _______ for being late to the meeting."
apologize,"Please _______ to your friend for hurting their feelings."
apologize,"It's important to _______ when you make a mistake."
apologize,"I _______ for interrupting you."
appalling,"The living conditions in the refugee camp were _____, with little access to food, water, or sanitation."
appalling,"The company's environmental record was _____, with evidence of widespread pollution and waste."
appalling,"The lack of diversity in the curriculum was _____, failing to reflect the richness and complexity of the world."
appalling,"The government's response to the crisis was _____, characterized by inaction and indifference."
appointment,"I have a doctor's _______ at 3 pm."
appointment,"I need to reschedule my _______ with the dentist."
appointment,"Did you make an _______ for the car service?"
appointment,"The meeting was an important _______ for the company."
appreciate,"I really ____ your help with this project."
appreciate,"The teacher ____ the students' hard work."
appreciate,"We ____ the beautiful view from the mountaintop."
appreciate,"It's important to ____ the little things in life."
approach,"The team decided to take a different ____ to the problem."
approach,"Her ____ to the project was methodical and efficient."
approach,"He had a unique ____ to solving puzzles."
approach,"We need to find a more sustainable ____ to resource management."
appropriately,"The teacher reminded the students to dress ____ for the school play."
appropriately,"It is important to respond to emails ____."
appropriately,"The chef ____ seasoned the dish to perfection."
appropriately,"The company spokesperson addressed the issue ____."
"approve of","I don't _______  of his behavior."
"approve of","My parents don't _______ of my new boyfriend."
"approve of","The teacher doesn't _______  of cheating."
"approve of","The committee needs to _______ of the proposal before we can move forward."
arrange,"The librarian helped me ____ the books by author."
arrange,"Please ____ these flowers in a vase."
arrange,"Can you ____ the chairs in a circle for the meeting?"
arrange,"She ____ her schedule to fit in the appointment."
artefact,"The archaeologist carefully brushed away the dirt to reveal a hidden _____."
artefact,"The museum's collection included ancient _____, some dating back thousands of years."
artefact,"The historian found a fascinating _____ that shed new light on the battle."
artefact,"The detective examined the _____ for fingerprints."
ascend,"The climbers began to ____ the treacherous mountain peak."
ascend,"The hot air balloon will ____ into the sky at dawn."
ascend,"The stock market is expected to ____ in the coming months."
ascend,"The young artist's career began to ____ after winning the prestigious award."
"ask for","I always ____ for a raise after a successful project."
"ask for","Don't be afraid to ____ for help when you need it."
"ask for","He ____ for a second chance, but she refused."
"ask for","The customer ____ for a refund after the product was damaged."
aspire,"I ______ to be a successful writer, so I spend hours every day working on my craft."
aspire,"Many people ______ to live a life of luxury and comfort."
aspire,"The young entrepreneur ______ to build a company that would change the world."
aspire,"After years of hard work, she finally ______ to reach her goal."
assemble,"The mechanic will _______ the engine parts in the correct order."
assemble,"The team worked together to _______ a winning strategy for the competition."
assemble,"It took hours to _______ the furniture for the new living room."
assemble,"The children _______ their Lego set to create a magnificent castle."
assess,"The teacher will ____ the students' progress on the project."
assess,"The doctor will ____ the patient's injuries."
assess,"The team will ____ the risks involved in the new venture."
assess,"The company will ____ the effectiveness of the marketing campaign."
assign,"The teacher will ____ a different project to each student."
assign,"The manager will ____  new tasks to the team members."
assign,"The doctor will ____ a specific medication to the patient."
assign,"The judge will ____  a sentence to the convicted criminal."
"assist somebody in something","The doctor will ____ the patient ____ recovering from surgery."
"assist somebody in something","The teacher ____ the students ____ understanding the complex equation."
"assist somebody in something","The experienced carpenter ____ the apprentice ____ building the bookshelf."
"assist somebody in something","The team leader ____ the new employees ____ completing the project."
associate,"I often _____ my favorite color with the feeling of happiness."
associate,"The company decided to _____ itself with a popular charity to improve its public image."
associate,"The detective tried to _____ the suspect with the crime scene."
associate,"It's important to _____ yourself with people who share your values."
assume,"I often ______ that everyone thinks the same way I do."
assume,"It's dangerous to ______ that everyone has the same background."
assume,"Don't ______ that you know what someone is thinking."
assume,"It's best to ______ the best in people, but be prepared for the worst."
assure,"The manager  ___  me that the shipment would arrive on time."
assure,"I can ___  you that I will keep your secret."
assure,"She ___  her parents that she would be home by midnight."
assure,"The doctor  ___  the patient that the surgery would be successful."
astonishment,"The magician's performance filled the audience with _____."
astonishment,"The scientists watched in _____ as the experiment yielded unexpected results."
astonishment,"The explorers gazed upon the ancient ruins in _____ and awe."
astonishment,"The child's _____ at the gift was plain to see."
attach,"Please ____ the file to this email."
attach,"Make sure you ____ the label to the package."
attach,"I need to ____ this document to my report."
attach,"Could you please ____ the receipt to your expense report."
attack,"The enemy launched a surprise ____ on the city."
attack,"The virus could ____ your computer's security system."
attack,"The dog's ____ was triggered by the stranger."
attack,"The politician's speech was seen as a direct ____ on the opposition."
attain,"She studied diligently to ____ her academic goals."
attain,"The athlete trained relentlessly to ____ peak physical condition."
attain,"The company strives to ____ a sustainable business model."
attain,"Through perseverance, they finally ____ their dream of owning a home."
attainment,"The student's _______ of a perfect score on the test was a testament to her hard work."
attainment,"Despite facing many challenges, she persevered and achieved her academic _______."
attainment,"The company's _______ of its financial goals was due in part to the CEO's visionary leadership."
attainment,"The artist's lifelong _______ of artistic mastery was evident in her breathtaking paintings."
attend,"I would love to ____ your graduation ceremony."
attend,"It is important to ____ all your classes."
attend,"I will ____ the meeting tomorrow."
attend,"Did you ____ the conference last week?"
attribute,"The success of the project can be largely ______ to the team's dedication."
attribute,"Many people ______ the company's downfall to poor management."
attribute,"He ______ his improved health to a change in diet."
attribute,"The artist ______ her unique style to her childhood experiences."
auditorium,"The school's annual play was held in the large ____."
auditorium,"The speaker addressed the audience from the stage in the ____."
auditorium,"The concert hall was designed to provide excellent acoustics for the ____."
auditorium,"The symphony orchestra performed in the majestic ____."
available,"The library has a wide selection of books ____ for checkout."
available,"This feature is not ____ on older models."
available,"There are limited seats ____ for the concert."
available,"I'm sorry, that item is no longer ____."
avert,"The quick thinking of the firefighters helped to _____ a major disaster."
avert,"The company's new safety protocols were implemented to _____ potential accidents."
avert,"It is important to seek help when you feel overwhelmed, to _____ a mental health crisis."
avert,"The diplomat worked tirelessly to _____ war between the two nations."
avoidable,"The accident was completely ____, caused by a simple mistake."
avoidable,"Many of the injuries sustained during the game were ____ with proper safety precautions."
avoidable,"The company's financial losses were ____ through better planning and management."
avoidable,"The argument was entirely ____, both parties could have chosen to communicate more effectively."
award,"The Nobel Prize is a prestigious ____ for outstanding contributions in various fields."
award,"She was nominated for an ____ for her groundbreaking research."
award,"The company received an ____ for its exceptional customer service."
award,"The athletes celebrated their victory with an ____ ceremony."
backward,"The car was driving ____ on the highway."
backward,"She walked ____ into the room, looking confused."
backward,"The teacher asked the students to write the alphabet ____."
backward,"The clock was ticking ____, making everyone nervous."
"badly in need of","The old house was ____ a fresh coat of paint."
"badly in need of","After weeks of drought, the garden was ____ a good watering."
"badly in need of","The tired traveler was ____ a good night's sleep."
"badly in need of","The struggling company was ____ a new marketing strategy."
barely,"I could ______ hear the music over the sound of the crowd."
barely,"The hiker was ______ able to reach the summit before nightfall."
barely,"The old car ______ had enough gas to make it to the next town."
barely,"She ______ recognized him after all these years."
bargain,"The antique store had a real ____ on a vintage record player."
bargain,"Finding a good deal on a flight is a ____ in the travel industry."
bargain,"The clearance sale at the department store was full of ____ items."
bargain,"With careful research, you can find incredible ____ online."
